titulo,empresa,fecha,herramientas,descripcion,ubicacion,presencialidad,funciones,jornada,experiencia,tipo_contrato,salario,solicitudes,fecha_scrapeo,url,portal
25246 Ing software con experiencia y formación en PHP y Symfony con discapacidad Barcelona,FUNDACION GRUPO SIFU,Hace 41 horas (Actualizada),Estudios: Ingeniería informática o similarInglés avanzadoConocimientos avanzados de PHP y Symfony,"Tener una sólida comprensión de los principios de la programación y un buen conocimiento de PHP.Saber testar códigos.Estar familiarizado con el diseño basado en dominios.Se valorará haber trabajado en pequeños proyectos realizando procesos completos. Tener experiencia con arquitectura distribuida, elasticsearch y optimizaciones de bases de datos.Información adicional:Pila tecnológica:Estamos trabajando con Symfony 2.8 / 4.4 PHP 7.4.Usamos algunos de los siguientes servicios y más: MariaDB, PostgreSQL, Algolia, ElasticSearch/OpenSearch, RabbitMQ, Redis, Varnish (caché), GitHub & GH Actions y NewRelic como herramienta de observación.El backend es principalmente un sistema monolítico por encima de 1M LOC, pero ofrecemos todas las características nuevas dentro de módulos dedicados/aislados.Estamos siguiendo los principios de DDD, pero no somos fanáticos al respecto.Nos beneficiamos de la entrega continua: implementamos tan pronto como se completa la revisión del código y todo está automatizado.",Barcelona,Teletrabajo parcial,"['Ingeniero de Software C#', 'Categoría o nivelTécnico']",Jornada Completa,No se requiere experiencia,Contrato Indefinido,Retribución sin especificar,3.0,2024-01-26,https://www.infoempleo.com/ofertasdetrabajo/25246-ing-software-con-experiencia-y-formacion-en-php-y-symfony-con-discapacidad/barcelona/2969176/,infoempleo
24723-Programadores/as Junior con inglés y CERTIFICADO DE DISCAPACIDAD España,FUNDACION GRUPO SIFU,Hace 17 horas (Actualizada),Formación y/o experiencia en programación.Inglés nivel B2. Disponer de certificado de disponibilidad.,"Empresa IT internacional, busca perfiles de programador.Si te gusta la programación, dispones de conocimientos de sistemas, aplicaciones web, cloud, o cualquier tipo de lenguaje informático apúntate y crearemos un puesto para ti.Buscamos personas con talento, ganas de aprender y disposición a mejorar.",España,Teletrabajo 100%,"['Programador', 'Categoría o nivelTécnico']",Jornada Completa,No se requiere experiencia,Contrato Indefinido,Retribución sin especificar,17.0,2024-01-26,https://www.infoempleo.com/ofertasdetrabajo/24723-programadoresas-junior-con-ingles-y-certificado-de-discapacidad/espanna/2968613/,infoempleo
Programador Labview Azpeitia (Guipúzcoa),ES SOLIDOS PROCESS ENGINEERING SL,Hace 17 horas (Actualizada),- Estudios: Ciclo Formativo Grado Superior/Ingeniería- Experiencia: 2 años mínimo como programador.- Persona dinámica con capacidad de trabajar en equipo.- Idiomas: Inglés.- Experiencia en .NET y SQL Server- Experiencia en Labview,ES SOLIDOS PROCESS ENGINEERING SL es una empresa de realiza proyectos de plantas de proceso para el manejo de sólidos y líquidos.Dentro del desarrollo de los sistemas de supervisión y control se ocupará del desarrollo de los programas desarrollados en  .NET Y SCADA LABVIEWDescripción de las tareas :Realizará las labores de desarrollo de aplicaciones en Labview así como programación en .NET de las instalaciones proyectadas.Puesta en marcha de las instalaciones y equipos junto con el equipo de automatización.Gestión de documentación.,Azpeitia (Guipúzcoa),,"['Analista-Programador .NET', 'Categoría o nivelTécnico']",Jornada Completa,Al menos 2 años de experiencia,Contrato Indefinido,Retribución sin especificar,6.0,2024-01-26,https://www.infoempleo.com/ofertasdetrabajo/programador-labview/azpeitia/2967799/,infoempleo
Mozo/a logístico/a expediciones San Sebastián de los Reyes (Madrid),"IMAN TEMPORING ETT, S.L.",Hace 41 horas (Actualizada),"Se valorará:- Experiencia en un puesto similar en gestión de transporte.- Conocimientos en Microsoft Office y gestión de correo electrónico.- Valorable positivamente tener conocimientos en logística.Si la oferta te parece interesante, inscríbete!","Desde IMAN Temporing, empresa especializada en RRHH, queremos acompañarte en tu trayectoria laboral. #ConectamoseltalentoconlasoportunidadesDesde nuestra oficina de Alcobendas, seleccionamos un/a mozo/a de logística parar dar servicio a importante empresa del sector tecnológico con presencia en diferentes puntos de Madrid. En este caso, el trabajo se desempeñaría en San Sebastián de los Reyes.Tus funciones serán las siguientes:- Recepción de la mercancía que entra al centro así como expedir todos los bultos según destinos.- Atender a los transportistas a su llegada.- Comprobar que los envíos y recepciones son correctos.- Realizar traspasos de materia a los departamentos correspondientes.- Mantener el orden del departamento.- Resolver incidencias vía email con los transportistas.- Preparar las expediciones según requerimientos del cliente.¿Qué ofrecemos?:- Horario: De L - V de 7:00 a 15:00h- Jornada: 40 horas semanales.- Contrato: sustitución vacaciones verano (julio y agosto inicialmente)- Salario: 10,75€? brutos/hora.",San Sebastián de los Reyes (Madrid),,"['Técnico de Hardware y Software', 'Categoría o nivelTécnico']",,No se requiere experiencia,,Entre 15.000 y 20.000€ Brutos/anuales,50.0,2024-01-26,https://www.infoempleo.com/ofertasdetrabajo/mozoa-logisticoa-expediciones/san-sebastian-de-los-reyes/2964874/,infoempleo
Técnico/a Sistemas Barcelona,"IMAN TEMPORING ETT, S.L.",Hace 41 horas (Actualizada),"- Formación de Grado medio o superior en sistemas y redes- Incorporación inmediataValorable conocimientos:- Windows Server, Citrix, Hyper-V y/o VMware.- Servicios: DHCP, DNS, NTP, NAT, etc...- Tecnologías (Switch/Firewalls): CISCO, Fortigate, Huawei, PFSense- Herramientas de monitorización (Zabbix, PingDom).- Herramientas de gestión de tiquets (SNOW, Remedy).- Certificaciones CCNA/CCNP y/o de otros fabricantes.Si la oferta te parece interesante ¡No dudes en inscribirte!","Desde IMAN Temporing, empresa especializada en RRHH, queremos acompañarte en tu trayectoria laboral. #ConectamoseltalentoconlasoportunidadesEmpresa ubicada en Terrassa especializada en espacio de trabajo virtual, precisa de técnico/a de sistemas y redes para realizar las siguientes funciones:- Administración de sistemas- Análisis de redes- Soporte de nivel 2 - Control logístico de los activos- Gestión de tickets de cliente externos (con timing)¿Qué ofrecemos?- Jornada partida - Horario de lunes a viernes de 11h a 20h (con 1h para comer) - Servicios de guardia 1 semana al mes (remuneración a parte)- Formato de trabajo:  3 días presencial y 2 días en remoto- Contrato por ETT",Barcelona,,"['Técnico de Sistemas', 'Categoría o nivelTécnico']",,Al menos 2 años de experiencia,,Entre 20.000 y 25.000€ Brutos/anuales,10.0,2024-01-26,https://www.infoempleo.com/ofertasdetrabajo/tecnicoa-sistemas/barcelona/2964764/,infoempleo
Técnico/a testeo impresoras con nivel medio de Inglés Sant Cugat del Vallés (Barcelona),"IMAN TEMPORING ETT, S.L.",Hace 41 horas (Actualizada),"- FPII/CFGS/CFGM Diseñador gráfico/Imprenta/Artes Gráficas/Informática - Conocimientos de programación de bajo nivel (C, C++, Python, TCL&#8230;) - Conocimientos medios de Linux - Valorable conocimientos en 3DS Max, Blender, AutoCAD, Netfabb.- Dominio de Excel - Nivel medio de inglés.Si la oferta te parece interesante ¡No dudes en inscribirte!","Desde IMAN Temporing, empresa especializada en RRHH, queremos acompañarte en tu trayectoria laboral. #ConectamoseltalentoconlasoportunidadesDesde IMAN Temporing Rubí, estamos buscando informáticos/as en el sector electrónico para la localidad de Sant Cugat del Vallès.Funciones:-Uso de programas como Pyton, TCL, C, Linux, etc.-Generar documentación y conclusiones de pruebas realizadas.- Uso de Excel. Se ofrece:- Horario de lunes a viernes intensivo de mañana y tarde.- Salario de 9,01 brutos la hora.",Sant Cugat del Vallés (Barcelona),,"['Administrador de Bases de Datos', 'Categoría o nivelTécnico']",,No se requiere experiencia,,Entre 15.000 y 20.000€ Brutos/anuales,6.0,2024-01-26,https://www.infoempleo.com/ofertasdetrabajo/tecnicoa-testeo-impresoras-con-nivel-medio-de-ingles/sant-cugat-del-valles/2963788/,infoempleo
Director/a OpEx El Puerto de Santa María (Cádiz),"IMAN TEMPORING ETT, S.L.",Hace 17 horas (Actualizada),"Será indispensable que tengas formación universitaria en Informática.También debes tener acreditado, al menos, nivel B2 de inglés.En informática, deberás manejar Excel y SAP en nivel avanzado. Si la oferta te parece interesante ¡No dudes en inscribirte!","¿Posees formación universitaria en Informática?¿Posees al menos 8 años de experiencia en las funciones que describiremos a continuación?¿Posees mínimo nivel B2 de inglés?Si estas en búsqueda activa de empleo, y has respondido afirmativamente a las preguntas... ¡Te estamos buscando!Iman selecciona a un/una director/a OpEx para empresa líder en el sector aeronáutico.La incorporación será directamente en plantilla de empresa con horario flexible.¿Qué harás?-	Dirección Técnica de equipo de Soporte TIC y PMO.-	Gestión integral del Software de la empresa.-	Gestión de la infraestructura electrónica.-	Gestión informática de PC, maquinaria y resolución de incidencias.-	Liderar mejoras de procesos productivos de la Empresa.-	Análisis de puntos críticos, gestión de proyectos y desarrollos.-	Gestionar los recursos humanos y materiales internos del Dpto., así como la relación directa con proveedores.-	Soporte informático dentro de la cadena productiva.-	Garantizar que todo el personal trabaja mediante cumplimiento del marco normativo.Valorable formación en  ITIL, PMP, Six Sigma, Lean, RGPD. Valorable MBA y Gestión Ambiental.No lo pienses más, ¡Estamos deseando conocerte!Desde IMAN Temporing, empresa especializada en RRHH, queremos acompañarte en tu trayectoria laboral. #Conectamoseltalentoconlasoportunidades",El Puerto de Santa María (Cádiz),,"['Director de Proyecto Informático', 'Categoría o nivelDirección']",,No se requiere experiencia,,Entre 35.000 y 40.000€ Brutos/anuales,7.0,2024-01-26,https://www.infoempleo.com/ofertasdetrabajo/directora-opex/el-puerto-de-santa-maria/2963672/,infoempleo
Técnico/a electrónico/a reparaciones San Sebastián de los Reyes (Madrid),"IMAN TEMPORING ETT, S.L.",Hace 17 horas (Actualizada),"Se valorará:- Conocimiento gamas blanca, marrón y gris.- Valorable positivamente haber trabajado en servicio postventa.- Valorable conocimientos de soldadura con lápiz o SMD.- Manejo nivel usuario de ordenador.- Conocimientos de reparación y mantenimiento electrónico.- 1 año de experiencia en puesto similar (taller, servicio de asistencia técnica).Si la oferta te parece interesante, inscríbete y nos pondremos en contacto contigo para comenzar en el departamento que mas se adapte a tu perfil.","Desde IMAN Temporing, empresa especializada en RRHH, queremos acompañarte en tu trayectoria laboral. #ConectamoseltalentoconlasoportunidadesDesde nuestra oficina de Alcobendas, seleccionamos Técnicos/as de reparación para servicio de postventa en empresa ubicada en San Sebastian de los Reyes. Tus funciones serán las siguientes:- Trabajarás dentro del departamento de Amazon, manipulando todo tipo de aparatos electrónicos, tales como batidoras, exprimidores, secadores de pelo, tostadoras...- Limpieza de parte y totalidad de aparatos y componentes electrónicos. - Testeo y reparación de los mismos.- Puesta a punto de aparatos electrónicos.- Cambio de piezas de aparatos y componentes electrónicos.¿Qué ofrecemos?:- Horario: De L - V turnos rotativos cada dos semanas de 06:35 a 14:30 horas y de 15:05 a 23:00 horas- contrato: temporal de 6 meses más posible incorporación a plantilla.- Jornada: 40 horas semanales.- Salario: 10,75€? brutos/hora.",San Sebastián de los Reyes (Madrid),,"['Técnico de Hardware y Software', 'Categoría o nivelTécnico']",,No se requiere experiencia,,Entre 15.000 y 20.000€ Brutos/anuales,26.0,2024-01-26,https://www.infoempleo.com/ofertasdetrabajo/tecnicoa-electronicoa-reparaciones/san-sebastian-de-los-reyes/2963470/,infoempleo
PROGRAMADOR/A INFORMÁTICO Torre Pacheco (Murcia),"IMAN TEMPORING ETT, S.L.",Hace 17 horas (Actualizada),Formación correspondienteConocimientos en SQL SERVERConocimientos en POO con C#Si la oferta te parece interesante ¡No dudes en inscribirte!,"Desde IMAN Temporing, empresa especializada en RRHH, queremos acompañarte en tu trayectoria laboral.#ConectamoseltalentoconlasoportunidadesImportante empresa del sector agrario precisa incorporar PROGRAMADOR/A INFORMÁTICO dentro de su equipo, para uno de sus almacenes situado en la zona de El Jimenado (TORRE PACHECO) .Se ofrece:Jornada completaSalario de 22000-25000€ brutos anualesIncorporación inmediataRequisitos:Formación correspondienteConocimientos en SQL SERVERConocimientos en POO con C#Se valorará:Conocimiento en administración de Servidores tanto físicos como en Cloud.Conocimientos en ERP (opcional Hispatec)¡Si la oferta te parece interesante no dudes en inscribirte!",Torre Pacheco (Murcia),,"['Analista-Programador SQL', 'Categoría o nivelTécnico']",,No se requiere experiencia,,Entre 20.000 y 25.000€ Brutos/anuales,27.0,2024-01-26,https://www.infoempleo.com/ofertasdetrabajo/programadora-informatico/torre-pacheco/2962625/,infoempleo
Tecnico/a de sistemas Donostia-San Sebastián (Guipúzcoa),"IMAN TEMPORING ETT, S.L.",Hace 41 horas (Actualizada),Persona con actitud proactiva y ganas de aprender.Disponibilidad inmediata y completa.Si la oferta te parece interesante ¡No dudes en inscribirte!,"Desde IMAN Temporing, empresa especializada en RRHH, queremos acompañarte en tu trayectoria laboral. #ConectamoseltalentoconlasoportunidadesDesde la oficina de San Sebastián buscamos técnico/a de sistemas para importante empresa ubicada en Donostia.Tus funciones:Resolución de incidencias de los clientes.Configuración y parametrización de servidores y servicios Windows principales.Creación y configuración de infraestructura hardware del cliente, tanto física como virtual.Revisión y control de servidores.Conocimientos en las herramientas de trabajo:Sistemas operativos Microsoft, escritorios de usuario y servidores.Controlador de dominio.DNS y hosting.Virtualización VMWARE.Redes y administración de Firewalls.Plataforma Microsoft Office 365, administrador.Que ofrecemos:Contrato a través de la empresa, selección directa.Salario: 22.000€ bruto anual",Donostia-San Sebastián (Guipúzcoa),,"['Técnico de Sistemas', 'Técnico de Soporte', 'Categoría o nivelTécnico']",,No se requiere experiencia,,Entre 20.000 y 25.000€ Brutos/anuales,27.0,2024-01-26,https://www.infoempleo.com/ofertasdetrabajo/tecnicoa-de-sistemas/donostia-san-sebastian/2962027/,infoempleo
Técnico/a Sistemas Terrassa (Barcelona),"IMAN TEMPORING ETT, S.L.",Hace 17 horas (Actualizada),"- Formación de Grado medio o superior en sistemas y redes- Incorporación inmediataValorable conocimientos:- Windows Server, Citrix, Hyper-V y/o VMware.- Servicios: DHCP, DNS, NTP, NAT, etc...- Tecnologías (Switch/Firewalls): CISCO, Fortigate, Huawei, PFSense- Herramientas de monitorización (Zabbix, PingDom).- Herramientas de gestión de tiquets (SNOW, Remedy).- Certificaciones CCNA/CCNP y/o de otros fabricantes.Si la oferta te parece interesante ¡No dudes en inscribirte!","Desde IMAN Temporing, empresa especializada en RRHH, queremos acompañarte en tu trayectoria laboral. #ConectamoseltalentoconlasoportunidadesEmpresa ubicada en Terrassa especializada en espacio de trabajo virtual, precisa de técnico/a de sistemas y redes para realizar las siguientes funciones:- Administración de sistemas- Análisis de redes- Soporte de nivel 2 - Control logístico de los activos- Gestión de tickets de cliente externos (con timing)¿Qué ofrecemos?- Jornada partida - Horario de lunes a jueves entre 8h-9h a 17h-18h y los viernes jornada intensiva.- Servicios de guardia 1 semana al mes (remuneración a parte)- Formato de trabajo:  3 días presencial y 2 días en remoto- Contrato por ETT",Terrassa (Barcelona),,"['Técnico de Sistemas', 'Categoría o nivelTécnico']",,Al menos 2 años de experiencia,,Entre 20.000 y 25.000€ Brutos/anuales,16.0,2024-01-26,https://www.infoempleo.com/ofertasdetrabajo/tecnicoa-sistemas/terrassa/2960430/,infoempleo
Perfil programación PHP + MYSQL para empresa de telecomunicaciones Los Barrios (Cádiz),CIRCET CABLEVEN,Hace 41 horas (Actualizada),"2 años de experiencia en programación PHP + MYSQLConocimiento básico de Sistema Operativo LinuxFront End : HTML, JavaScript y Conocimiento Framework de desarrollo (Bootstrap Materialize y Metro UI)Se valora lenguaje Phyton y Angular","programación PHP + MYSQLConocimiento básico de Sistema Operativo LinuxFront End : HTML, JavaScript y Conocimiento Framework de desarrollo (Bootstrap Materialize y Metro UI)Se valora lenguaje Phyton y Angular",Los Barrios (Cádiz),,"['Programador', 'Categoría o nivelTécnico']",Jornada Completa,Al menos 2 años de experiencia,Contrato Indefinido,Retribución sin especificar,21.0,2024-01-26,https://www.infoempleo.com/ofertasdetrabajo/perfil-programacion-php-mysql-para-empresa-de-telecomunicaciones/los-barrios/2960120/,infoempleo
Técnico de desarrollo web y posicionamiento SEO avanzado Zamora,Importante empresa del sector de informática en Zamora,Hace 21 horas (Actualizada),"- Estudios requeridos mínimo: Técnico Superior en familia de informática de gestión o similar.- Experiencia: 12 meses en puestos similares.- Informática, deseable: WordPress, Joomla, CMS, herramientas SEO, social media, programas de gestión de procesos (ERPs).- Idiomas: Comprensión de inglés técnico.- Incorporación deseable al puesto: Inmediata.- Carnet de conducir: B1.- Disponibilidad de vehículo propio.- Disponibilidad para viajar ocasionalmente.- Valorable: Formación en prevención de riesgos laborales, técnico básico de prevención.- Se busca estabilidad laboral del perfil de puesto y que se busque desarrollo profesional a largo plazo.",-Desarrollo de páginas web.-Creación de la tienda online o E-Commerce y alta del catálogo de productos.-Social Media Plan. Monitorización de redes sociales. Auditoría Social Media. Gestión de una red social. Publicación de posts.-Posicionamiento básico en internet. Análisis de palabras clave. Análisis de la competencia. SEO On-Page. SEO Off-Page. Informes mensuales de seguimiento-Implantación de programas de gestión con Odoo.-Apoyo auxiliar y puntual al área de administración de sistemas.-Personal a cargo: No,Zamora,,"['Diseñador Web', 'Especialista SEO', 'Categoría o nivelTécnico']",,Al menos 1 año de experiencia,,Retribución sin especificar,14.0,2024-01-26,https://www.infoempleo.com/ofertasdetrabajo/tecnico-de-desarrollo-web-y-posicionamiento-seo-avanzado/zamora/2959436/,infoempleo
TECNICO/A DE CAMPO - IT Palau-Solità i Plegamans (Barcelona),"IMAN TEMPORING ETT, S.L.",Hace 41 horas (Actualizada),"Si la oferta te parece interesante ¡No dudes en inscribirte! OFICINA IMAN MOLLET DEL VALLESREQUISITOS:Experiencia en servicio de campo.Capacidad para solucionar problemas, probar, reparar y dar servicio al equipo técnico.Capacidad para trabajar en turnos flexibles y adaptarse a los horarios de trabajo cambiantes.Familiaridad con herramientas y aplicaciones móviles.Título técnico o certificación.","Desde IMAN Temporing, empresa especializada en RRHH, queremos acompañarte en tu trayectoria laboral. #ConectamoseltalentoconlasoportunidadesDesde la oficina de IMAN TEMPORING MOLLET estamos en búsqueda de un TECNICO/A DE CAMPO-IT. Las tareas a desarrollar serían las siguientes:Brindar servicios y soportes al usuario durante el día entre la planta industrial o despachos.Saber vincular el flujo de trabajo a la programación o la planificación del día.Gestionar todas las tareas de instalación, reparación, mantenimiento y prueba in situ.Diagnosticar errores o problemas técnicos y determinar las soluciones adecuadas si no se escalará el caso a su responsable.Realizar informes de servicio detallados y oportunos, procesos de documentos.Operar el vehículo de manera segura y que tome la responsabilidad.Seguir todos los procedimientos y protocolos presentados por el departamento.Cooperar con el equipo técnico y compartir información en toda la organización.Comprender los requisitos de los usuarios y realizar las recomendaciones / asesoramiento informático adecuado.Construir relaciones positivas con los usuarios.Mantener impresoras industriales: preventivo y correctivo y predictivo.Organizar el almacén informático.Gestionar pedidos básicos del departamento.Recibir bultos de informática de la garita.Gestionar tarjetas de acceso incluyendo altas/bajasDar acceso al torno",Palau-Solità i Plegamans (Barcelona),,"['Técnico de Soporte', 'Categoría o nivelTécnico']",,No se requiere experiencia,,Entre 15.000 y 20.000€ Brutos/anuales,43.0,2024-01-26,https://www.infoempleo.com/ofertasdetrabajo/tecnicoa-de-campo-it/palau-solita-i-plegamans/2958879/,infoempleo
Técnico/a testeo impresoras con nivel medio de Inglés Sant Cugat del Vallés (Barcelona),"IMAN TEMPORING ETT, S.L.",Hace 41 horas (Actualizada),"- FPII/CFGS/CFGM Diseñador gráfico/Imprenta/Artes Gráficas/Informática - Conocimientos de programación de bajo nivel (C, C++, Python, TCL&#8230;) - Conocimientos medios de Linux - Valorable conocimientos en 3DS Max, Blender, AutoCAD, Netfabb.- Dominio de Excel - Nivel medio de inglés.Si la oferta te parece interesante ¡No dudes en inscribirte!","Desde IMAN Temporing, empresa especializada en RRHH, queremos acompañarte en tu trayectoria laboral. #ConectamoseltalentoconlasoportunidadesDesde IMAN Temporing Rubí, estamos buscando informáticos/as en el sector electrónico para la localidad de Sant Cugat del Vallès.Funciones:-Uso de programas como Pyton, TCL, C, Linux, etc.-Generar documentación y conclusiones de pruebas realizadas.- Uso de Excel. Se ofrece:- Horario de lunes a viernes intensivo de mañana y tarde.- Salario de 9,01 brutos la hora.",Sant Cugat del Vallés (Barcelona),,"['Administrador de Bases de Datos', 'Categoría o nivelTécnico']",,No se requiere experiencia,,Entre 15.000 y 20.000€ Brutos/anuales,7.0,2024-01-26,https://www.infoempleo.com/ofertasdetrabajo/tecnicoa-testeo-impresoras-con-nivel-medio-de-ingles/sant-cugat-del-valles/2958643/,infoempleo
Auxiliar Informático/a Junior. 4 meses Madrid (Madrid),"IMAN TEMPORING ETT, S.L.",Hace 6 horas (Actualizada),CFGM o CFGS en Mantenimiento de Equipos informáticos.Experiencia de al menos 6 meses.Si la oferta te parece interesante ¡No dudes en inscribirte!,"Desde IMAN Temporing, empresa especializada en RRHH, queremos acompañarte en tu trayectoria laboral. #ConectamoseltalentoconlasoportunidadesDesde la oficina de Iman en Madrid seleccionamos un/a Auxiliar de Informática Junior para empresa especializada en sistemas de geolocalización ubicada por la zona de Arturo Soria- Sanchinarro. Funciones:- Configuración de Equipos informáticos.- Mantenimiento de Equipos informáticos.- Apoyo en la gestión de sistemas, redes, datos y seguridad.- Apoyo en la configuración y uso de dispositivos. - Mantenimiento de hardware y resolución de incidencias. Se ofrece:- Horario: lunes a viernes de 9h a 18h (1 hora comida)- Salario: 8.40€ brutos/hora (1.340€ brutos/mes aprox.)- Contrato eventual 4 meses.",Madrid,,"['Consultor de Informática', 'Categoría o nivelTécnico']",,No se requiere experiencia,,Entre 15.000 y 20.000€ Brutos/anuales,90.0,2024-01-26,https://www.infoempleo.com/ofertasdetrabajo/auxiliar-informaticoa-junior-4-meses/madrid/2957233/,infoempleo
Técnico/a Sistemas con discapacidad Terrassa (Barcelona),"IMAN TEMPORING ETT, S.L.",Hace 17 horas (Actualizada),"- Disponer del certificado de discapacidad- Formación de Grado Superior en sistemas y redes- Incorporación inmediata- Idiomas: Catalán y español nativos                Inglés avanzado Conocimientos:- Windows Server, Citrix, Hyper-V y/o VMware.- Servicios: DHCP, DNS, NTP, NAT, etc...- Tecnologías (Switch/Firewalls): CISCO, Fortigate, Huawei, PFSense- Herramientas de monitorización (Zabbix, PingDom).- Herramientas de gestión de tiquets (SNOW, Remedy).- Certificaciones CCNA/CCNP y/o de otros fabricantes.Si la oferta te parece interesante ¡No dudes en inscribirte!","Desde IMAN Temporing, empresa especializada en RRHH, queremos acompañarte en tu trayectoria laboral. #ConectamoseltalentoconlasoportunidadesEmpresa ubicada en Terrassa especializada en espacio de trabajo virtual, precisa de técnico/a de sistemas y redes para realizar las siguientes funciones:- Administración de sistemas- Análisis de redes- Soporte de nivel 2 y 3- Control logístico de los activos- Resolución de incidencias de nivel 2 y 3¿Qué ofrecemos?- Jornada partida - Horario de lunes a jueves entre 8h-9h a 17h-18h y los viernes jornada intensiva.- Servicios de guardia 1 semana al mes (remuneración a parte)- Formato de trabajo:  3 días presencial y 2 días en remoto- Contrato directo por empresa",Terrassa (Barcelona),,"['Técnico de Sistemas', 'Categoría o nivelTécnico']",,Al menos 5 años de experiencia,,Entre 20.000 y 25.000€ Brutos/anuales,14.0,2024-01-26,https://www.infoempleo.com/ofertasdetrabajo/tecnicoa-sistemas-con-discapacidad/terrassa/2956487/,infoempleo
