titulo,empresa,fecha,herramientas,descripcion,ubicacion,funciones,jornada,experiencia,tipo_contrato,salario,fecha_scrapeo,url,portal
Integrador/a de APIs,HAYS,25/01/2024,"API, java, Maven, Spring","En HAYS estamos colaborando con una empresa que gestiona campañas publicitarias en el punto de venta para llegar a los consumidores durante su proceso de compra.Gracias a su continua investigación sobre el comportamiento del comprador, es capaz de ofrecer las mejores soluciones de comunicación a las marcas basadas en el concepto “Right Place, Right Time”.Estamos actualmente en búsqueda de un Programador/a de APIS para incorporarse a un proyecto retador.Requisitos: - Lenguajes orientados a objetos (Java) y su ecosistema (Maven, Spring, JUnit, etc.)  - Lenguajes web (Angular, Javascript, etc.)  - Bases de Datos (MySQL) y ORM (JooQ)  - Bases de Datos NoSQL (MongoDB) y ODM (Morphia) - Valorable  - Testear APIs con Postman Funciones: - Revisar la documentación de las APIs externas, facilitadas por los proveedores.  - Revisar la documentación de nuestras apps, para entender la integración.  - Realizar la integración entre nuestras apps y los servicios de terceros. Ofrecemos: - Compañía lider en su sector  - Horario flexible  - Contratación como autónomo  - Salario competitivo Estamos esperando perfiles como el tuyo, apasionados con la tecnología y que quiera enfrentarse a un nuevo reto. Si es tu caso, inscríbete en la oferta para que podamos contarte más!",Barcelona - España,Programador,Jornada completa,3 años,Indefinido,,26/01/24,https://www.tecnoempleo.com/integrador-apis-barcelona/api-java-maven-spring/rf-87e019bc32eb530fa346,tecnoempleo
Ingeniero/a I+D,HAYS,25/01/2024,"SolidWorks, Catia","Tu nueva empresaImportante empresa especializada en productos de inyección de plástico, con ubicación en Bages, requiere incorporar un/a Ingeniero/a I+D.Tu nuevo puestoComo Ingeniero/a I+D, reportando al Director de I+D y en estrecha colaboración con el resto de departamentos, la persona seleccionada se encargará de gestionar todo el procesos de desarrollo del producto; desarrollo y diseño de nuevos productos, análisis de costes de materiales, contacto con clientes y proveedores, gestión y solución de problemas técnicos, etc. Qué necesitarás para el puesto Para ello deberás haber cursado una Ingeniería Técnica o similar, experiencia mínima de 3 años como ingeniero en empresas de inyección de plástico, conocimientos en taller, experiencia con programa Solid Works y Catia (V5). Imprescindible nivel alto de inglés. Qué obtendrás a cambioFormarás parte de una empresa sólida y con gran reconocimiento en el sector, con un proyecto atractivo, buen ambiente laboral, colaboración íntegra de proyectos, contrato indefinido y un salario acorde a experiencia aportada. Tu horario será de 8h a 17h (flexible: horario de entrada entre 8h-9:30), teletrabajo, salario 35.000€ - 40.000€ SBA",Barcelona (Híbrido),I+D,Jornada completa,3 años,Indefinido,,26/01/24,https://www.tecnoempleo.com/ingeniero-i-d-hibrido/solidworks-catia/rf-4a881262b2c3036ec841,tecnoempleo
Full Stack Developer (Angular /Java),HAYS,25/01/2024,"Angular, Java","Desde Hays, estamos trabajando para una empresa tecnológica con multitud de proyectos de producto propio al día con las últimas versiones de tecnología, que está buscando incorporar un desarrollador Full Stack con Angular y Java para incorporarse a su equipo.Será el responsable del desarrollo así como del liderazgo técnico del equipo, participarás en las decisiones diseño, desarrollo y arquitectura del software en proyectos del sector movilidad fundamentalmente.¿Qué necesitas?Contar con + 3 años de experiencia en programación Full Stack (Java/Angular), con bases de datos relaciones (PostgreSQL) / no relaciones (MongoDB), liderando técnicamente proyectos de desarrollo, por lo que contar con habilidades de comunicación y gestión de equipo será esencial para liderar un equipo de hasta 3 personas. Además, haber trabajado en la gestión de colas¿Qué obtendrás a cambio?Incorporarte a un equipo joven, innovador con un proyecto estable y solvente, en el que la flexibilidad horaria y la modalidad remota te permitirá tener una conciliación personal.",Valencia - España,Programador,Jornada completa,3 años,Indefinido,,26/01/24,https://www.tecnoempleo.com/full-stack-developer-angular-java-valencia/angular-java/rf-52b9188b222173c6e247,tecnoempleo
Programador/a ABAP (Presencial),Grupo Digital,25/01/2024,"ABAP, SAP","Desde Grupo Digital, estamos en búsqueda de un/a Programador/a ABAP.Ubicación: Getafe (Madrid).Modalidad de trabajo: 100% presencial.Funciones: mantenimiento de la aplicación de SAPSalario: 21.000 -25.000 € B/A en función de experiencia.Funciones:* Al menos 2 de experiencia en desarrollo ABAP - SAP.* Conocimiento de Remedy* Inglés B1Grupo DigitalSomos un grupo de empresas tecnológicas, formado actualmente por unos 400 profesionales, en distintas áreas: desarrollo, sistemas, ingeniería automática, consultoría... Si quieres impulsar tu carrera con un proyecto único de la mano de una multinacional de primerísimo nivel, no dudes en presentar tu candidatura. ¡Te esperamos!",Madrid (Presencial),Programador,Jornada completa,2 años,Indefinido,,26/01/24,https://www.tecnoempleo.com/programador-abap-presencial-presencial/abap-sap/rf-448c1005a257536f7f45,tecnoempleo
Desarrollador Android,Michael Page,25/01/2024,"android, Kotlin","Perfil buscado (Hombre/Mujer)- Diseño y desarrollo de aplicaciones internas con Android y/o Kotlin.- Arquitectura MVVM, inyección de dependencias, etc.- Producto orientado s microservicios.- Definición de historias de usuario y planificación de tareas.- Best practices.- TDD, CI/CD, etc.- Equipo multidisciplinar• Proyecto estable, 100% teletrabajo|Formarás parte de un ecosistema de Talento Tecnológico- Al menos 2-3 años de experiencia demostrable desarrollando con Android.- Experiencia laboral con Kotlin es un plus.- Importante conocer TDD y aplicarlo.- Metodologías ágiles- Interesado en evolucionar y aprender de las nuevas tecnologías.- Vehículo propio.Page Consulting Tech Solutions, es el área de PageGroup especializada en la realización de proyectos IT en clientes, ofreciendo una amplia variedad de soluciones tecnológicas a medida con la flexibilidad y agilidad requerida. • Contrato indefinido con Page Tech Solutions• Salario: 30-42k• Ubicación: Barcelona, alrededores.• Modalidad: 3 días oficina, 2 teletrabajo• Formación continua para desarrollar tu talento• Beneficios sociales y plan de retribución flexible.• Compensación de gastos de teletrabajo• Plan de carrera en un ecosistema de talento tecnológico.",Barcelona (Híbrido),Desarrollador Móvil,Jornada completa,3 años,Indefinido,33.000 €-45.000 € Bruto/año,26/01/24,https://www.tecnoempleo.com/desarrollador-android-hibrido/android-kotlin/rf-a79e15a3229203a2f043,tecnoempleo
Brand Manager,Michael Page,25/01/2024,marketing,"Perfil buscado (Hombre/Mujer)   Si eres la persona seleccionada, tendrás las siguientes responsabilidades; • Crear y desarrollar la estrategia de marketing para las marcas lujo del grupo. • Analizar las tendencias del mercado. • Gestionar las campañas publicitarias. • Supervisar la creación de material audiovisual. • Relación transversal con los departamentos de la compañía. Ser el nexo entre ecommerce, comercial-ventas y fotografía-diseño.  • Compañía familiar líder en el sector de la relojería en pleno crecimiento|Oportunidad de formar parte de uno de los grupos relojeros más importantes    Si eres la persona seleccionada, tendrás que cumplir los siguientes requisitos; Formación en marketing y/o comunicación. Formación especializada en marketing digital y branding. Experiencia mínima en una posición similar de 3 años, valorable en el sector de la joyería y el lujo. Capacidad analítica para conocer las necesidades del mercado y de los consumidores. Capacidad de reacción ante posibles incidencias. Capacidad creativa para idear acciones de marketing digital innovadoras y atractivas. Habilidades comunicativas para saber transmitir la misión, la visión, los objetivos y los valores de una marca.   Grupo relojero familiar en pleno crecimiento con presencia en más de 100 países.   Oportunidades de carrera y desarrollo profesional.",Barcelona - España,Marketing,Jornada completa,3 años,Indefinido,,26/01/24,https://www.tecnoempleo.com/brand-manager-barcelona/marketing/rf-141c13bfd271b375fe40,tecnoempleo
.NET Developer,Michael Page,25/01/2024,"Net, C#","Perfil buscado (Hombre/Mujer)Seleccionamos un/a Desarrollador/a .NET que asuma las siguientes responsabilidades:• Trabajar en estrecha colaboración con otros desarrolladores front-end, back-end o full stack, como parte de un equipo ágil de scrum.• Crear código escalable y reutilizable, pruebas, documentación y mantenimiento del back-end de la aplicación.• Desarrollar software de alta calidad, incluidas pruebas unitarias para producir código con un bajo número de defectos sin dejar de cumplir con nuestros plazos.• Proporcionar estimaciones realistas para solicitudes, correcciones y nuevas ideas.• Trabajar con Product Owner y UX Design para garantizar que el producto qudesarrollado sea apropiado para las necesidades de la empresa.• Participar en todas las ceremonias de scrum y ser parte de la mejora continua del desempeño del equipo.• .NET Developer - Full Remote|Importante cliente final que desarrolla un producto propioDeberás aportar experiencia en:• Desarrollo de Microsoft: .NET C#, SQL Server y la nube de Azure.• Importante: LinQ, Entity Framework, ASP.NET MVC, .NET web API, SQL Server, Git. Valioso: Azure/AWS, .NET core, WCF, principios SOLID, arquitectura de microservicios.Imprescidible aportar buen nivel de inglés a nivel conversacional.Nuestro cliente es una empresa británica que desarrolla un producto propio basado en las últimas tecnologías de Microsoft. Seleccionamos un Desarrollador .NET para su estructura en Andalucía, con posibilidad de full-remote.• Full remote.• Horario flexible.• Salario entre 35 - 45k. • Beneficios sociales.• Planes de carreras definidos.• Formación continua.",Madrid - España,Programador,Jornada completa,3 años,Indefinido,33.000 €-45.000 € Bruto/año,26/01/24,https://www.tecnoempleo.com/net-developer-madrid/net-c/rf-92c51b29d2a3a32ff042,tecnoempleo
Consultor/a Funcional Dynamics CRM,Michael Page,25/01/2024,"Dynamics, C#","Perfil buscado (Hombre/Mujer)• Colaborar con los clientes para comprender sus necesidades comerciales y traducirlas en requisitos funcionales.• Realizar análisis de brechas para determinar las personalizaciones necesarias en Dynamics CRM.• Diseñar soluciones funcionales utilizando Microsoft Dynamics CRM, asegurando la alineación con las mejores prácticas y los objetivos del cliente.• Configurar y personalizar Dynamics CRM según los requisitos del cliente.• Gestionar la implementación de soluciones, asegurando una transición suave desde la etapa de desarrollo hasta la producción.• Desarrollar scripts y flujos de trabajo personalizados según sea necesario para adaptarse a los procesos comerciales específicos.• Proporcionar formación a los usuarios finales y al equipo de soporte técnico sobre el uso efectivo de Dynamics CRM.• Ofrecer soporte continuo para resolver problemas y optimizar el rendimiento del sistema.• Participar en la planificación y gestión de proyectos relacionados con Dynamics CRM.• Colaborar con otros equipos, como desarrolladores, arquitectos de soluciones y analistas de negocios, para garantizar una ejecución exitosa del proyecto.• Mantener documentación detallada de configuraciones, personalizaciones y procesos para referencia interna y del cliente.• Supervisar el rendimiento del sistema y proponer mejoras continuas para optimizar la eficiencia y la satisfacción del cliente.• Consultora tecnológica partner de Microsoft, líder de su sector.|Experiencia mínima de 2 años como Consultor/a funcional Dynamics CRM• Experiencia previa como consultor funcional Dynamics CRM.• Conocimiento profundo de Microsoft Dynamics CRM y sus módulos.• Habilidades de programación y capacidad para desarrollar soluciones personalizadas en lenguajes como C#.• Fuertes habilidades de comunicación y capacidad para trabajar de forma remota de manera efectiva.• Certificaciones en Dynamics CRM son una ventaja.Consultoría tecnológica especializada y partner de Microsoft.• Trabajo remoto al 100%.• Flexibilidad de horarios.• Oportunidades de desarrollo profesional y certificación continua.",100% En remoto,Consultor,Jornada completa,3 años,Indefinido,,26/01/24,https://www.tecnoempleo.com/consultor-funcional-dynamics-crm-remoto/dynamics-c/rf-f0e71dc452d503f87945,tecnoempleo
Analista funcional Java/RPA Senior,Grupo Digital,25/01/2024,"java, RPA","Desde Grupo Digital buscamos un/a AF Java RPA para proyecto estableTareas:• Coordinación de equipos de Estados intermedios dentro del equipo correctivo • Análisis y coordinación de implantación de los robots RPA dentro de Multicanal• Reuniones con el cliente de cara a toma de requisitos para funcionales• Preparación de propuestas de mejora al cliente.• Estimaciones de tiempos de mejora• Detección de riesgos• Automatización de procesos• Análisis y localización de causas raíces derivados de EEII.• Análisis y localización de causas raíces derivados de despliegues.• Formación a compañerosExperiencia:Grupo DigitalSomos un grupo de empresas tecnológicas, formado actualmente por unos 400 profesionales, en distintas áreas: desarrollo, sistemas, ingeniería automática, consultoría... Si quieres impulsar tu carrera con un proyecto único de la mano de una multinacional de primerísimo nivel, no dudes en presentar tu candidatura. ¡Te esperamos!",Madrid (Híbrido),Analista,Jornada completa,2 años,Indefinido,,26/01/24,https://www.tecnoempleo.com/analista-funcional-java-rpa-senior-hibrido/java-rpa/rf-66f11bb9f2fc93bc654c,tecnoempleo
Tech Lead Java,Michael Page,25/01/2024,"java, Microservicios","Perfil buscado (Hombre/Mujer)- Liderazgo técnico del equipo de desarrollo, con funciones de formación, acompañamiento y apoyo técnico cuando sea necesario, además de llevar la comunicación con el cliente en las distintas fases de los proyectos.• Incorporación en empresa en expansión en continua innovación tecnológica|Proyecto a largo plazo con desarrollo profesional y tecnológico- Experiencia de al menos 8 años en Desarrollo Java (8, 11, 16, 17) con arquitecturas de MicroserviciosMicroservicios.- Experiencia mínima de 1-2 años como TechTech LeadLead, con funciones directamente vinculadas con el código.Empresa tecnológica internacional en pleno momento de crecimiento busca a un Technical Leader especializado en entornos Java con Microservicios, para incorporarse de forma permanente y 100% Remota, basado en España.- Contrato permanente en empresa puntera tecnológicamente con excelentes proyectos a largo plazo y ambicioso plan de carrera a medio y largo plazo.- Salario fijo + complemento para formaciones anuales + seguro médico privado- Puesto 100% remoto, con flexibilidad horaria y fuerte apuesta por la conciliación.",100% En remoto,Jefe de Proyecto,Jornada completa,Más de 5 años,Indefinido,48.000 €-60.000 € Bruto/año,26/01/24,https://www.tecnoempleo.com/tech-lead-java-remoto/java-microservicios/rf-f1ce1fe9a2f45300ee41,tecnoempleo
Desarrollador Fullstack Angular + Node,Michael Page,25/01/2024,"Angular, Node, TypeScript","Perfil buscado (Hombre/Mujer)• Te incorporarás en el ámbito de negocio I&O • Desarrollarás tecnologías Fullstack• Trabajarás con metodologías ágiles• Solo residentes en España• Proyecto estable|Formarás parte de un ecosistema de Talento Tecnológico.• Experiencia de 3/4 años con Angular (12 o superior)• Experiencia de 3 años en NodeJS con TypeScript• Conocimientos solidos en Bases de Datos SQL• Experiencia valorable en Cloud (Google Cloud)Page Consulting Tech Solutions, es el área de PageGroup especializada en la realización de proyectos IT en clientes, ofreciendo una amplia variedad de soluciones tecnológicas a medida con la flexibilidad y agilidad requerida. • Contrato indefinido con Page Tech Solutions• Hasta 43k• 100% remoto• Formación continua para desarrollar tu talento• Beneficios sociales y plan de retribución flexible.• Compensación de gastos de teletrabajo • Plan de carrera en un ecosistema de talento tecnológico.",100% En remoto,Programador,Jornada completa,3-5 años,Indefinido,33.000 €-45.000 € Bruto/año,26/01/24,https://www.tecnoempleo.com/desarrollador-fullstack-angular-node-remoto/angular-node-typescript/rf-f0051a375234c3686045,tecnoempleo
Project Manager,Michael Page,25/01/2024,"Autocad, Solidworks","Perfil buscado (Hombre/Mujer)Las principales funciones que desarrollarás como Ingeniero/a de proyectos son:• Desarrollo y gestión de proyectos• Elaboración de planos en Autocad y Solidworks• Diseño/Seguimiento/Supervisión de montaje de plantas de procesos.• Diseño/cálculo de recipientes a presión• Elaboración de presupuestos• Asistencia a montajes y puestas en marcha• Importante empresa del sector industrial|Al menos 6 años de experiencia profesional• Formación en Ingeniería Industrial, Ingeniería Mecánica o similares• Al menos 6 años de experiencia profesional en gestión de proyectos• Dominio avanzado de AutoCAD y Solidworks• Nivel alto de inglés• Disponibilidad para viajar Importante empresa de fabricación de maquinaria industrial perteneciente a un gran grupo empresarial y con más de 30 años de experiencia en su sector.Oportunidades de carrera y desarrollo profesional",CastellónEspaña,Ingenieros/Industria,Jornada completa,Más de 5 años,Indefinido,30.000 €-33.000 € Bruto/año,26/01/24,https://www.tecnoempleo.com/project-manager-castellon/autocad-solidworks/rf-70b518fba2f953f8bd44,tecnoempleo
IT Project Manager (.NET),Michael Page,25/01/2024,"NET, Azure","Perfil buscado (Hombre/Mujer)- Gestión end-to-end de las distintas fases del proyecto, desde la toma de requerimientos del producto, a la definición del alcance funcional del proyecto, análisis de la solución, participando en las historias de usuario, integración del producto con los sistemas existentes, asegurando la calidad y cumplimiento de las buenas prácticas. Control de cambios, participación en el testeo y verificación de las funcionalidades, preparación de producción.• Incorporación permanente en cliente final con producto propio en expansión|Proyecto a largo plazo con desarrollo profesional y tecnológico- Experiencia de al menos 3 años como IT Project Manager, habiendo trabajado en entornos de desarrollo de aplicaciones web (.NET, Azure).- Experiencia habiendo trabajado con .NET y Azure DevOps, a nivel de preparación de backlog con desarrolladores.Cliente final internacional del ámbito industrial en pleno momento de expansión, busca a un IT Project Manager para liderar los diferentes proyectos internos de desarrollo de Software en entornos .NET y Azure.- Contrato permanente en cliente final líder en el sector, con excelente plan de desarrollo a largo plazo.- Salaro competitivo de fijo + variable + beneficios.- Modelo híbrido remoto-presencial de 50% de teletrabajo, oficina zona noreste de Madrid.",Madrid (Híbrido),Jefe de Proyecto,Jornada completa,3 años,Indefinido,45.000 €-54.000 € Bruto/año,26/01/24,https://www.tecnoempleo.com/it-project-manager-net-hibrido/net-azure/rf-dac2185cf241d390d54f,tecnoempleo
Technical Salesforce Consultant - SSC,Michael Page,25/01/2024,Salesforce,"Perfil buscado (Hombre/Mujer)Purpose of the role is to provide technical oversight to ensure smooth functioning and optimisation for the Salesforce Platform. A Technical Analyst will work as a bridge between the business needs and the technical capabilities of the platform working closely with Functional team, Salesforce Vendors, Support Specialists and Developers. As part of CC service delivery team, the technical analyst will need to ensure that the Salesforce platform (from a non-functional perspective) is used effectively through the available features and to support its business goals.Key Responsibilities:• Work with 3rd party vendors to define best development practices and ensure they are being followed.• Involved in technical assessment of solutions & peer review of code from other developers.• Help, where required, the technical support team to analyse production incidents and to reach a solution.• Co-ordinate with testing, security, functional consultants to ensure Salesforce solutions adhere to functional, non-functional & Security requirements.• Troubleshoot and resolve technical issues related to Salesforce solutions.• Stay up to date with the latest Salesforce features, technologies, and trends.• Work with technical team for adaption of new & decommission of outgoing salesforce features.• Provide support to Salesforce users when necessary.• Engage with Page´s Vendor management team on optimum license utilisation.• Collaborate with other Page IT teams to integrate Salesforce with chosen enterprise systems.• Provide technical guidance and maintenance for backup and deployments.• Multinational company  |Experience as Technical Salesforce Consultant,  at least 3 years.• Bachelor´s degree in computer science, Information Technology, or a related field• 3+ years of experience as a Salesforce Technical or a similar role• Proven experience in developing and implementing Salesforce solutions.• Strong understanding of Salesforce architecture, development methodologies, and best practices• Proficient in Salesforce development tools and technologies (Apex, Visualforce, Salesforce CLI)• Excellent understanding of data modelling and data migration principles• Excellent communication and collaboration skills• Ability to work independently and as part of a team.• Ability to learn new technologies quickly.Desired Skills:• Salesforce Certified Administrator certification.• Salesforce Certified Platform App Builder certification• Experience with Salesforce Lightning Experience (LEX) development• ExperiencewithSalesforceintegrationtechnologiesPageGroup SSC• Join into a multinational company.• Career path.• Flexibility.• Benefits.",Barcelona - España,Consultor,Jornada completa,3 años,Indefinido,,26/01/24,https://www.tecnoempleo.com/technical-salesforce-consultant-ssc-barcelona/salesforce/rf-95511b344287a39a794c,tecnoempleo
Desarrollador ABAP,Michael Page,25/01/2024,"ABAP, SAP","Perfil buscado (Hombre/Mujer)• Definirás y desarrollarás estándares técnicos.• Ayudarás en las pruebas para validar y proporcionar controles operativos para garantizar que se cumplen los requisitos de desarrollo.• Mantenimiento correctivo/evolutivo/legal.• Colaborarás en las modificaciones o mejoras del sistema SAP• Buscamos un perfil con orientación al cliente interno, organizado y teamplayer.|Para el desarrollo e implementación de proyectos SAP.• Estudios en Informática o equivalente (universitarios o de CFGS).• Mínimo de 3 años de experiencia como desarrollador de SAP.• Experiencia en desarrollo ABAP principalmente módulos SAP FI/ MM/ SD, en el desarrollo de Smartforms, Adobe Forms y mantenimiento de SAP Scripts...Valoraremos positivamente :•  Experiencia con FIORI - SAPUI5 y SAP Gateway.•  Valoraremos positivamente experiencia con HANA.•  Nivel medio-alto en inglés.Consolidada empresa en el sector del Ocio y Entretenimiento donde se trabaja siempre con las últimas tecnologías.Oportunidades de carrera y desarrollo profesional.Flexibilidad horaria y de vacaciones.Amplio catálogo de formación técnica y en idiomas a tu alcance.",Barcelona - España,Programador,Jornada completa,3 años,Indefinido,,26/01/24,https://www.tecnoempleo.com/desarrollador-abap-barcelona/abap-sap/rf-aa39163822ef3391144f,tecnoempleo
Associate Director Data Products,HAYS,25/01/2024,"data, AWS","Responsibilities - Develop strategic data platform to create product and services road maps from concept to development to launch.  - Be the responsible for the platform adoption, product engineering, service design, security and compliance, and business process change.  - Drive enterprise-wide scalability, re usability, and sustainability of Data platforms and services.  - Focus and align innovation efforts with the business and IT strategy and legal requirements.  - Establish strategies, implementation of plans and identify capbilities & ecosystem partnership.  - Collaborate with business in gathering requirements and ongoing data product enhancements. Requirements - +10 years of experience working in IT roles  - +5 years working on data and analytics as a data engineer, data product or data architect.  - Strong familiarity with AWS. Desirable Snowflake service offerings.  - Desirable: Experience in ECS and DEVOPS  - Experience delivering data lake projects (data acquisition, quality, transformation and publishing)  - Solid understanding of data security and data governance  - Experience working in Agile methodologies  - Understand the Analytical Data Life Cycle management Benefits - Contract: Permanent full-time position  - Starting date: as soon as possible  - 2/week telework",Barcelona (Híbrido),Big Data,Jornada completa,Más de 10 años,Indefinido,,26/01/24,https://www.tecnoempleo.com/associate-director-data-products-hibrido/data-aws/rf-ed9f14c012a423636942,tecnoempleo
