titulo,empresa,fecha,herramientas,descripcion,ubicacion,presencialidad,funciones,jornada,experiencia,tipo_contrato,salario,solicitudes,fecha_scrapeo,url,portal
Unity developer Barcelona,Page Personnel,Hace 9 días,Conocimiento demostrable de entre 2-4 años en:Conocimientos sólidos de programación en C#.Conocimientos de patrones y arquitectura de software.Experiencia en optimización de procesos y rendimiento.,"Desarrollador de software experimentado que use la plataforma Unity para diseñar y producir una plataforma virtual innovadora.Descripción de la oferta Programación: Escribir código en C# para implementar la lógica del juego, la física, la inteligencia artificial y otros aspectos del software.  Diseño de Juegos: Trabajar en la creación y diseño de niveles, personajes, objetos y otros elementos del juego.  Gráficos y Animación: Crear efectos visuales, animaciones y trabajar con gráficos para mejorar la calidad visual del juego.  Física y Simulación: Implementar sistemas de física para crear un comportamiento realista en el juego.  Integración de Audio: Incorporar efectos de sonido y música en el juego para mejorar la experiencia del usuario.  Optimización del Rendimiento: Optimizar el rendimiento del juego para garantizar que se ejecute de manera eficiente en diferentes plataformas.  Desarrollo Multiplataforma: Adaptar el juego para que funcione en diversas plataformas como PC, consolas, dispositivos móviles y realidad virtual.  Resolución de Problemas: Identificar y solucionar problemas técnicos y de diseño durante el desarrollo del juego.  Colaboración: Trabajar en equipo con diseñadores, artistas y otros desarrolladores para lograr una visión cohesiva del juego.  Actualización y Mantenimiento: Realizar actualizaciones y mantenimiento continuo del juego después del lanzamiento para corregir errores y agregar nuevas características.Perfil del candidatoConocimiento demostrable de entre 2-4 años en:    Conocimientos sólidos de programación en C#.  Conocimientos de patrones y arquitectura de software.  Experiencia en optimización de procesos y rendimiento.  Conocimientos en matemáticas 3D espaciales.  Familiaridad con metodologías Agile/Kanban y flujos de desarrollo de software.  Conocimientos de Git y control de versiones.  Conocimientos de Photon para implementar funcionalidades de multiplayer.  Haber trabajado con AssetBundles y gestión de grandes cantitades de objetos.  Conocimiento del funcionamiento de la memoria en aplicaciones de Unity.  Conocimientos del 3D y sus características (UV, vértices, materiales, animaciones).  Comprensión de los principios de diseño de juegos y experiencia en la implementación de mecánicas de juego.  Familiaridad con los componentes de Unity, como animaciones, partículas y físicas.  Fuertes habilidades de resolución de problemas y capacidad para depurar errores.Oferta de empleo Oportunidades de carrera y desarrollo profesional.  Empresa en crecimiento.  Salario competitivo.   Modalidad Híbrida (Barcelona).   Contrato indefinido.",Barcelona,,"['Programador', 'Categoría o nivelTécnico']",Jornada Completa,Al menos 3 años de experiencia,Contrato Indefinido,Retribución sin especificar,0.0,2024-01-26,https://www.infoempleo.com/ofertasdetrabajo/unity-developer/barcelona/3014048/,infoempleo
Scraping engineer (Python/JavaScript + PHP) Barcelona,Page Personnel,Inscripción cerrada,At least 2 years of experience in web scraping. Experience working with Data extraction technologies such as Scrappy or Puppeteer. Previous experience working with PHP.,"Opportunity to keep growing as a Developer (Scrapping + PHP) within an international company.Description Participate in the development of new functionalities using PHP and Symfony.  Participate in the design of the new architecture.  Develop additional features on existing applications.  Ensure the scalability of the product maintaining the high quality of the code using PHP unit.   Modelling, designing, coding, testing automation, scripting, packagingProfile At least 2 years of experience making web scraping (JavaScript or Python).  Knowledge of scraping tools such as Scrappy or Puppeteer.  Experience working with PHP (Symfony).   Valuable automation technologies such as Selenium.   Valuable experience AWS, Docker.Job Offer Salary range: 30K-40K.  Remote: 100%  Healthcare insurance.  Formations budget.",Barcelona,,"['Analista-Programador', 'Categoría o nivelTécnico']",Jornada Completa,Al menos 2 años de experiencia,Contrato Indefinido,Retribución sin especificar,0.0,2024-01-26,https://www.infoempleo.com/ofertasdetrabajo/software-engineer-php-scraping/espanna/3014027/,infoempleo
Desarrollador/a React Madrid,Page Personnel,Hace 9 días,Experiencia 3-5 años en desarrolloExperiencia con ReactInglés B2 o superior,"¿Buscas un reto como desarrollador Frontend? ¿Tienes experiencia en desarollo y, en concreto, con React? Te animo a seguir leyendo:Descripción de la oferta Desarrollo Frontend  Trabajarás con STACK como: Javascript, CSS, HTML, React, AJAX, jQuery, GIT y SASS  Posibilidad de gestionar equipo.Perfil del candidato Experiencia alrededor de 3-4 años en desarrollo  Dominio avanzado con React  Inglés B2 o superiorOferta de empleo Contrato indefinido  Trabajar para empresa final, contrato directamente con el cliente.   Modalidad híbrida: 2 días remoto, 3 días oficina. Más adelante, podrás optar a un modelo más flexible y adaptado a tus preferencias  Horario 9:00-18:00h; viernes jornada intensiva.   Banda salarial: 30.000-45.000€, este es el presupuesto estimado para esta vacante, pero el salario a ofertar dependerá del recorrido previo de cada candidato/a.",Madrid,,"['Analista-Programador', 'Categoría o nivelTécnico']",Jornada Completa,Al menos 3 años de experiencia,Contrato Indefinido,Retribución sin especificar,1.0,2024-01-26,https://www.infoempleo.com/ofertasdetrabajo/desarrolladora-react/madrid/3013843/,infoempleo
Ingeniero/a de sistemas VMware Cloud Foundation Madrid,GRUPO CRIT,Hace 9 días,Entre los requisitos basicos se encuentra: Experiencia como responsable de 2 o 3 años como minimo.,"Desde el Grupo Crit estamos trabajando en la busqueda de un/a Ingeniero/a de sistemas VMware Cloud Foundation, cuyas principales funciones seran trabajar con tecnologias como: VMware vSphere and Cloud Foundation VMWare NSX -T VMWare SDDC VMware vSAN VSphere replication Site Recovery Manager de VMWareCuyas principales funciones seran: Miembro del equipo con responsabilidad de gestionar el entorno de VMware vSphere y Cloud Foundation Infrastructure Implementar cambios en el entorno. Administración y mantenimiento continuo necesario para el correcto funcionamiento y evolución de los sistemas, equipos informáticos y configuración. Gestión de cambio e incidencias Planificar y ejecutar actualizaciones periódicas de equipos de TI (servidores, almacenamiento y actualización de software, parcheos, etc…) Implementar prácticas y procesos para garantizar que todos los servicios operativos cumplan con los objetivos de disponibilidad definidos en todo momento Capacidad predictiva (determinación de tendencias y previsiones), analizar informes/tendencias y recomendar planes de acción. Recuperación ante desastres Orquestación y automatización de procesos Migraciones V2V/ P2VActualmente estamos ofreciendo: Contrato indefinido con cliente final Trabajo estable Posibilidad de desarrollo y crecimiento profesional Beneficios sociales",Madrid,,"['Responsable de Desarrollo', 'Categoría o nivelMando intermedio']",Jornada Completa,Al menos 3 años de experiencia,Contrato Indefinido,Retribución sin especificar,0.0,2024-01-26,https://www.infoempleo.com/ofertasdetrabajo/ingenieroa-de-sistemas-vmware-cloud-foundation/madrid/3013787/,infoempleo
Consultor/a GRC (100% remoto desde España) España,Page Personnel,Hace 10 horas (Actualizada),"Titulación universitaria (Informática, Ingeniería de sistemas o similares) reconocida en España o equiparable.  Experiencia profesional mínima 6 años, con al menos 4 años en proyectos ENS.  Experiencia en consultoría ENS en el ámbito de Infraestructuras Críticas (LPIC) en AAPP  Conocimientos y experiencia en herramientas de gestión de riesgos (Pilar/Global Suite)  Experiencia en la realización de auditorías de seguridad  Experiencia gestión y en la implementación de planes de tratamiento de riesgos.  Capacidad analítica y habilidades de comunicación efectiva, tanto escrita como verbal.  Excelentes habilidades de comunicación y capacidad para trabajar en equipo.  Fuertes habilidades analíticas y capacidad para resolver problemas complejos.  Buenas habilidades de presentación y redacción de informes  Alto grado de profesionalidad, ética y compromiso.   Experiencia otros marcos regulatorios/normativos (ITL/2000, 27001, 22301, GDPR).","¡Tenemos una oportunidad profesional para consultores GRC! Si te interesa continuar tu desarrollo profesional en una vacante 100% remoto (DESDE ESPAÑA, es necesario vivir aquí)  Evaluar y verificar cumplimiento de normativa de seguridad ENS.  Proporcionar asesoramiento y soporte a los clientes en materia de cumplimiento.  Analizar riesgos asociados a sistemas de información y proponer medidas de mitigación.  Asesorar en proyectos relacionados con protección de infraestructuras críticas en AAPP.  Elaborar informes y documentación asociada a las tareas de consultoría.  Desarrollo y mantenimiento de políticas y procedimientos de seguridad.  Trabajar con los clientes para identificar y seleccionar soluciones tecnológicas  Elaboración de informes ejecutivos en materia de seguridad y cumplimiento.  Mantenerse actualizado en leyes y regulaciones de seguridad y privacidad de datos.  Elaboración y ejecución de planes de formación y concienciación en ciberseguridad  Apoyo a desarrollo negocio (Identificación necesidades, oportunidades, apoyo preventa)  Proporcionar formación y capacitación a equipos internos.",España,Teletrabajo 100%,"['Consultor de Informática', 'Consultor IT Cyber', 'Consultor IT Risk', 'Categoría o nivelTécnico']",Jornada Completa,Al menos 4 años de experiencia,Contrato Indefinido,Retribución sin especificar,0.0,2024-01-26,https://www.infoempleo.com/ofertasdetrabajo/consultora-grc-100-remoto-desde-espanna/espanna/3013785/,infoempleo
Senior Fullstack Sant Joan Despí (Barcelona),THE WISE SEEKER S.L,Hace 17 horas (Actualizada),"Conocimientos y experiencia previo con:TypeScriptReactNestJS o EspressJSBases de datos relacionales.GitSoft skills:Planificación.Comunicación con otras áreas de la empresa.Trabajo en equipo.Conocimientos requeridos imprescindiblesConocimientos y experiencia previo con: TypeScript, React, NestJS o EspressJS, Bases de datos relacionales y GitUnos 4-5 años de experiencia liderando equiposPriorizan la presencialidad, pero teletrabajan los jueves.",Buscamos un perfil full stack senior con experiencia gestionando equipos de IT.Las tecnologías principales son NestJS y React. En ambas utilizarán TypeScript para la programación.,Sant Joan Despí (Barcelona),,"['Analista-Programador', 'Programador Full-Stack', 'Categoría o nivelTécnico']",Jornada Completa,Entre 3 y 9 años de experiencia,Contrato Indefinido,Retribución sin especificar,0.0,2024-01-26,https://www.infoempleo.com/ofertasdetrabajo/senior-fullstack/sant-joan-despi/3013657/,infoempleo
Desarrollador .NET San Sebastián de los Reyes (Madrid),THE WISE SEEKER S.L,Hace 41 horas (Actualizada),Almenos 2 años de experienciaConocimientos de WPF sobre tecnologías .NETExperiencia en desarrollo de interfaces de usuario.Experiencia en integración de protocolos y sistemas.Compromiso de permanencia en proyecto a largo plazo para la creación de producto propio.Deseable:Conocimientos en C++ 17.Conocimientos de herramientas de desarrollo para arquitecturas embebidas.Conocimientos de procesado de video.Conocimientos de Bases de Datos.Experiencia en desarrollo de interfaces gráficas para entornos y aplicaciones de Seguridad y Defensa.Experiencia en integración de sistemas de Seguridad y Defensa.,"Realizar tareas de desarrollo de software de una plataforma propia para integración de sensores, protocolos y sistemas heterogéneos en aplicaciones civiles y militares.Acometer una Fase Inicial de Formación de la plataforma a lo largo de un período comprendido entre 3 y 5 meses.Coordinación semanal de sus actividades bajo la supervisión de un Responsable Senior de Desarrollo Software.Coordinación mensual de sus actividades bajo la supervisión de un Director de Proyectos.Completar objetivos de desarrollo marcados por el Responsable Senior de Desarrollo Software y el Director de Proyectos.Estar en contacto con las tecnologías actuales del mercado para poder aportar valor e ideas propias a la plataforma software.Descubrir necesidades reales de clientes y proyectos para poder tener iniciativa en el desarrollo y en la creación de soluciones.Desarrollo creativo de nuevas funcionalidades y modos operativos adaptadas al mercado de Seguridad y Defensa.",San Sebastián de los Reyes (Madrid),Teletrabajo parcial,"['Analista-Programador', 'Programador .NET', 'Analista-Programador .NET', 'Categoría o nivelTécnico']",Jornada Completa,Al menos 2 años de experiencia,Contrato Indefinido,Entre 30.000 y 35.000€ Brutos/anuales,4.0,2024-01-26,https://www.infoempleo.com/ofertasdetrabajo/desarrollador-net/san-sebastian-de-los-reyes/3013581/,infoempleo
Ingeniero/a Firmware sector automoción Baix Llobregat (híbrido) Barcelona,Page Personnel,Hace 41 horas (Actualizada),"Formación en Ingeniería informática, Electrónica o similar  Nivel de Inglés Avanzado  Experiencia y/o conocimientos en:  Control de motores: preferiblemente DC brushed.  Comunicaciones: CAN J1939, CANOpen y LIN.  Test de software: unitary testing y static analysis (MISRA-C rules).  Programación C y ensamblador.  Herramientas de desarrollo: SVN, CCS, S32DS, CANoe, JIRA y Parasoft.  Buscamos una persona proactiva, creativa y resolutiva, capaz de aportar soluciones frente los retos técnicos.","Como desarrollador de SW embebido trabajarás en el equipo de I+D de una empresa con reconocido prestigio a nivel mundial en el sector automoción donde tendrás una visibilidad completa del proceso de creación del SW Embebido.  Diseñar e implementar el software de los sistemas acuerdo a los requisitos del resto de departamentos de Ingeniería y de los clientes.  Asegurar la calidad del SW desarrollado mediante tests unitarios y de integración.  Calibrar las soluciones SW en campo y ejecución de tests funcionales para validar que el funcionamiento es el esperado.  Elaboración de documentación técnica (Gestión de requisitos SW, Documentos de diseño de módulos de SW, Compliance Matrix, Product Spec, DFMEA, Risk Assessment, definición EoL/ICT/FCT) así como mantener debidamente actualizado el sistema de control de versiones.  Resolver las anomalías de calidad detectadas durante la fabricación de los prototipos, pre-series y series, cuya causa raíz esté vinculada con el software.",Barcelona,Teletrabajo parcial,"['Programador', 'Técnico de Calidad y/o Pruebas', 'Técnico de I+D', 'Arquitecto de Software', 'Categoría o nivelTécnico']",Jornada Completa,Al menos 3 años de experiencia,Contrato Indefinido,Retribución sin especificar,1.0,2024-01-26,https://www.infoempleo.com/ofertasdetrabajo/ingenieroa-firmware-sector-automocion-baix-llobregat-hibrido/barcelona/3013643/,infoempleo
SW Team Lead empresa Robot quirúrgico Barcelona (Barcelona),Page Personnel,Hace 47 horas (Actualizada),"Titulación relacionada con ingeniería Informática, Matemática, física o similar.  Experiencia previa en gestión de proyectos de SW  Experiencia en gestión de personas.  Experiencia en metología en V/waterfall  Experiencia en procesos de validación de SW","Incorpórate como SW Team Lead del equipo de desarrollo de una compañía especializada en el desarrollo de un robot quirúrgico disruptivo.   Soporte en las actividades de investigación de pre-diseño (desarrollo)  Coordinar actividades relacionadas con dispositivos médicos.  Soporte en actividades de desarrollo y coordinación de actividades relacionadas con el diseño, desarrollo verificación y validación del sistema.  Aportación de ideas y soluciones relacionados con nuevos desarrollos.  Coordinar y ayudar con la preparación y revisión de documentación relacionada con diseño y desarrollo.  Despliegue de los requerimientos funcionales del sistema en especificaciones del SW.  Participar en gestión de riesgos del sistema.  Gestión de la trazabilidad de la validación del SW: diseño de especificaciones, testeo unitario, de integración y regresión, medidas de control de riesgo del SW, cambios en la arquitectura del SW.  Participación en reuniones de seguimiento con el equipo.  Gestión de proveedores.  Determianción de requisitos para la adquisición servicios/productos.  Soporte en la evaluación de proveedores  Cumplir con los requirimientos de quality management systems.",Barcelona,,"['Jefe de I+D', 'Responsable de Proyectos I+D', 'Jefe de Informática', 'Categoría o nivelMando intermedio']",Jornada Completa,Al menos 4 años de experiencia,Contrato Indefinido,Retribución sin especificar,0.0,2024-01-26,https://www.infoempleo.com/ofertasdetrabajo/sw-team-lead-empresa-robot-quirurgico/barcelona/3013640/,infoempleo
Embedded SW Engineer- Edge computing- (Híbrido) Barcelona (Barcelona),Page Personnel,Hace 6 horas (Actualizada),"PhD/BS/MS en ingeniería y especialidad en Embedded Software.  Conocimientos de arquitecturas modernas CPU (RISC-V) y micro-arquitecturas.  Conocimiento avanzado de Embedded C y RISC-V ISA.  Experiencia en desarrollo de al menos dos de los siguientes: baremetal, embedded RTOS, embedded Linux   Conocimientos de herramientas de desarrollo Risc-V: GNU/LLVM, GDB, QEMU, SPIKE.  Experiencia previa en microcontroladores o simulador de HW  Alto nivel de inglés.  Espíritu de trabajo en equipo.","Como ingeniero/a de SW embedded formarás parte de un equipo de trabajo internacional donde participarás en toda la fase de desarrollo del SW embebido basado en arquitectura RISC-V y orientado a aplicaciones de AI en el edge.   Desarrollo de drivers/firmware para arquitectura RISC-V.  Desarrollo e implementación de arquitectura RISC-V: interrupts/exceptions, firmware, drivers, application.  Desarrollo de drivers y aplicaciones para RTOS y Embedded Linux.  Adaptación de aplicaciones AI/ML a dispositivos embedded.",Barcelona,,"['Arquitecto de Software', 'Categoría o nivelTécnico']",Jornada Completa,Al menos 2 años de experiencia,Contrato Indefinido,Retribución sin especificar,0.0,2024-01-26,https://www.infoempleo.com/ofertasdetrabajo/embedded-sw-engineer-edge-computing-hibrido/barcelona/3013639/,infoempleo
Linux Kernel Engineer-microprocesadores - Híbrido Barcelona (Barcelona),Page Personnel,Hace 30 horas (Actualizada),"+4 años de experiencia en desarrollo de Linux kernel.  Experiencia en debug del kernel   Experiencia en Kernel multiplataforma y desarrollo de sistemas.  Experiencia en sistemas operativos a bajo nivel y HW.  Experiencia en UEFI, ACPI, PCIe, y otras especificaciones relacionadas con servidor.  Experiencia usando Kernel perf y/o tracing tools  Experiencia en el proceso completo de creación del SW  Conocimientos de C, Assembly y sistemas.","Como ingeniero/a de Linux Kernel formarás parte de un equipo internacional altamente cualificado y serás responsable de analizar los requisitos del Kernel que cada equipo tiene (FW, HW, etc).  Desarrollar soluciones alineadas con los requisitos de kernel que cada equipo pueda tener (firmware, hardware, etc.).  Aplicar modificaciones o crear soluciones para lanzamiento de 1-2 kernels.  Dar soporte en la mejora de la infraestructura de tesing automatizado.  Contribuir en la ejecución optima de lanzamiento de Kernels.",Barcelona,,"['Ingeniero de Desarrollo Electrónico Hw/Sw', 'Analista-Programador', 'Categoría o nivelTécnico']",Jornada Completa,Al menos 4 años de experiencia,Contrato Indefinido,Retribución sin especificar,1.0,2024-01-26,https://www.infoempleo.com/ofertasdetrabajo/linux-kernel-engineer-microprocesadores-hibrido/barcelona/3013637/,infoempleo
C++ SW Engineer empresa aeronáutica (Baix Llobregat) Barcelona,Page Personnel,Hace 41 horas (Actualizada),Ingeniería técnica (mínimo)  Experiencia en programación de SW con C++  Experiencia en desarrollo de nuevo código y mantenimiento del existente.  Cumplimentación de documentación.  Experiencia en gestión de versiones (GIT)  Experiencia previa con QT/QML.  Valorable conocimientos de Java y Python.,Como ingeniero/a de SW serás responsable de los desarrollos de los equipos de control de la aeronave y formarás parte de un equipo multidisciplinar de ingeniero/as  Programación de software de tierra para un sistema aéreo no tripulado   Generación de documentación  Puestas en marcha   Entorno Linux y Windows.   Portabilidad entre sistemas.   Control de versiones y compatibilidad (Git)   Desarrollo de pruebas de test unitario y de sistema   Mantenimiento de la librería existente,Barcelona,,"['Analista-Programador', 'Programador', 'Programador C++', 'Ingeniero de Software C++', 'Categoría o nivelTécnico']",Jornada Completa,Al menos 3 años de experiencia,Contrato Indefinido,Retribución sin especificar,0.0,2024-01-26,https://www.infoempleo.com/ofertasdetrabajo/c-sw-engineer-empresa-aeronautica-baix-llobregat/barcelona/3013635/,infoempleo
Cloud Engineer (Google Cloud) Madrid,Page Personnel,Hace 12 días,Cloud Enginner (Google Cloud),"Cloud Engineer (Google Cloud).Descripción de la oferta Diseño de soluciones para la infraestructura cloud.  Implementación de mejoras (auto-escalado, alta disponibilidad, automatización de despliegues, sistema de monitorización, etc).  Análisis de rendimiento y prevención de riesgos en los sistemas.Perfil del candidato Conocimientos de infraestructura sobre algún proveedor de nube (AWS, Azure, …) Idealmente, sobre GCP.  Conocimientos sobre sistemas Linux y scripting en bash.  Conocimientos sobre infraestructura como código, idealmente con Terraform.  Monitorización de sistemas para detección de problemas. Y valoran positivamente las siguientes:  CI / CD como administrador.  Conocimientos de Docker.  Conocimiento de bases de datos SQL. Idealmente, también NoSQL.  Conocimientos de backend, para poder participar activamente en las decisiones que se tomen en estos campos.Oferta de empleo Producto propio.  Trabajo en remoto 3 días a la semana (100% remoto si resides fuera de Madrid).  Jornada intensiva los viernes, y mes y medio en verano.  Formación continua sobre múltiples tecnologías y clases de inglés.  Facilidades para asistir a eventos tecnológicos.",Madrid,,"['Administrador de Sistemas', 'Categoría o nivelTécnico']",Jornada Completa,Al menos 3 años de experiencia,Contrato Indefinido,Retribución sin especificar,0.0,2024-01-26,https://www.infoempleo.com/ofertasdetrabajo/cloud-engineer-google-cloud/madrid/3013630/,infoempleo
