titulo,empresa,fecha,herramientas,descripcion,ubicacion,presencialidad,funciones,jornada,experiencia,tipo_contrato,salario,solicitudes,fecha_scrapeo,url,portal
Tecnico de sistemas / Administrador de sistemas (H/M) Pinto (Madrid),ANANDA GESTION ETT,Hace 17 horas (Actualizada),"•	Experiencia mínima 3 años en puesto similar•	Ciclo formativo de grado superior en el ámbito de la informática o las telecomunicaciones•	Persona con capacidad de organización, que sepa priorizar tareas, resolutiva, etc.","•	Soporte presencial y remoto para la resolución de incidencias.•	Instalaciones hardware y software en puestos de clientes.•	Mantenimiento y reparación hardware siguiendo los parámetros establecidos.•	Documentación de guías de uso para usuarios.•	Resolución de consultas sobre el software instalado en los equipos de usuario final (sistema operativo, paquetes ofimáticos, correo electrónico, …)•	Manejo sobre paquetes ofimáticos. Formación ""in-situ"" a usuarios finales en el uso de herramientas ofimáticas. •	Analizar, identificar y adelantarse a las necesidades de los equipos científicos comunes para evitar incidencias en su servicio.•	Generación de informes de seguimiento.•	Conocimiento en PHP, HTML y CSS•	Mantenimiento y Reparación hardware siguiendo los parámetros establecidos.•	Ubicación y conexionado de equipos.•	Traslado de equipamiento común para realizar los trabajos necesarios.•	Configuración de electrónica y servicios de red.•	Administración de sistemas de entornos Windows, Linux, y MAC.•	Será muy conveniente haber obtenido una certificación oficial de Microsoft, así como tener experiencia demostrable en el manejo del resto de los sistemas operativos de usuario del CFMAC (Linux y MacOS)•	Manejo de herramientas ticketing (remedy, GLPI, easyvista, etc…)•	Nociones sobre VOZ IP y telefonía analógica•	Gestión de Active Directory & Exchange (cualquier versión reciente 2012, 2016, 2019) •	Conocimiento cableado estructurado (parcheo tomas, crimpado)",Pinto (Madrid),,"['Administrador de Sistemas', 'Técnico de Sistemas', 'Categoría o nivelTécnico']",Jornada Parcial,Al menos 3 años de experiencia,Contrato Indefinido,Entre 20.000 y 21.000€ Brutos/anuales,35.0,2024-01-26,https://www.infoempleo.com/ofertasdetrabajo/tecnico-de-sistemas-administrador-de-sistemas-hm/madrid/3010585/,infoempleo
Técnico/a jr. de it c1e1e10d Barcelona,Adecco,Hace 17 horas (Actualizada),Grado superior informáticaValorable formación complementaria en gestión de infraestructuras TICAl menos 3 años en posiciones similares.Mandatory : Inglés (mín B2)Valorable :  Dynamics,"¿Tienes experiencia en el ámbito Informático? Te interesa el sector Farma y te gustaría tener la oportunidad de trabajar en una empresa multinacional de primer orden en el sector? En esta oferta te daremos la oportunidad de poder trabajar en una empresa con un sólido recorrido. Principales funciones: Realizar el levantamiento de necesidad, análisis, tracking y monitoring de aplicaciones locales solicitadas por el cliente interno. Realizar formación a personal interno. Crear y realizar seguimiento de solicitudes accesos a Dynamics. Creación de guías, manuales y documentación.En Adecco creemos en la igualdad de oportunidades y apostamos por el Talento Sin Etiquetas",Barcelona,,"['Técnico de Hardware y Software', 'Categoría o nivelTécnico']",,Al menos 3 años de experiencia,,Retribución sin especificar,2.0,2024-01-26,https://www.infoempleo.com/ofertasdetrabajo/tecnicoa-jr-de-it-c1e1e10d/barcelona/3010376/,infoempleo
Soporte técnico/a it con discapacidad 6285fb20 Barcelona,Fundación Adecco,Hace 41 horas (Actualizada),"Para que puedan valorar tu candidaturas necesitaremos:- Experiencia previa en puesto similar, resolviendo problemas técnicos/as complejos y aportando soluciones innovadoras- Conocimientos sólidos técnicos/as de hardware, software e infraestructura de redes informáticas- Competencia en la implantación y gestión de sistemas operativos Windows, Linux y/o Mac.- Experiencia con tecnologías de virtualización (por ejemplo, VMware, Hyper-V).- Experiencia con entornos en la nube (por ejemplo, AWS, Azure).- Familiaridad con los procesos ITIL y las mejores prácticas.- Excelentes habilidades de comunicación y liderazgo.- Se valorarán certificaciones como CompTIA A+, Linux LPI, Microsoft Certified Solutions Expert (MCSA) o equivalente.- Se valorará la licenciatura en tecnologías de la información, informática o un campo relacionado (o experiencia equivalente).Personas con discapacidad: Será necesario disponer de un Certificado de Discapacidad oficial igual o superior al 33% emitido por el organismo público competente.","Cuentas con experiencia en administración y gestión de sistemas? ¿Te gusta el trato con las personas prestando soporte técnico/a para la resolución de incidencias informáticas? Empresa internacional del sector de la comunicación y el entretenimiento se encuentra en búsqueda de un/a personas para trabajar como IT support desempeñando las siguientes funciones:- Proporcionar asistencia técnico/a especializada y solucionar problemas complejos de hardware, software y redes.- Tutelar y guiar al personal subalterno de asistencia informática, compartiendo conocimientos y mejores prácticas.- Dirigir la implantación, configuración y mantenimiento de sistemas informáticos, servidores y aplicaciones de software.- Colaborar con otros equipos de TI para implantar y mejorar el rendimiento, la seguridad y la fiabilidad de los sistemas.- Desarrollar y mantener documentación técnica, incluidos artículos de la base de conocimientos, procedimientos operativos estándar y guías de solución de problemas.- Realizar actualizaciones del sistema, parches e instalaciones de software.- Coordinar y ejecutar proyectos de TI, garantizando el cumplimiento de los plazos y los resultados.- Supervisar y analizar el rendimiento del sistema, identificando áreas de mejora y aplicando medidas proactivas.- Mantenerse al día de las tecnologías emergentes y las tendencias del sector, formulando recomendaciones para mejorar la infraestructura de TI.- Impartir sesiones de formación y talleres para educar a los usuarios finales sobre sistemas, herramientas y mejores prácticas de TI.- Mantener relaciones sólidas con vendedores/as y proveedores/as de servicios, coordinando los esfuerzos de asistencia y resolución de problemas cuando sea necesario.",Barcelona,,"['Técnico de Soporte', 'Categoría o nivelTécnico']",,Al menos 2 años de experiencia,,Retribución sin especificar,7.0,2024-01-26,https://www.infoempleo.com/ofertasdetrabajo/soporte-tecnicoa-it-con-discapacidad-6285fb20/barcelona/3010271/,infoempleo
Ingeniero/a Firmware empresa electrónica en el Vallés Barcelona,Page Personnel,Inscripción cerrada,"Ingeniería Electrónica - TelecomunicacionesInglés nivel B2-C1Experiencia en control de motores (brushless de imanes permanentes, inducción, universal)Experiencia en control de displays TFTFunction","Incorpórate a un equipo de ingeniero/as especializados en desarrollo de electrónica para sector automoción e industrial como Linux embedded.Descripción de la oferta  Liderazgo del proyecto de Software del proyecto asignado  Diseño y desarrollo de Software en lenguaje C para control de motores o para interfaces gráficas mediante TFT/QT  Definición y gestión de requisitos técnicos de los proyectos asignados  Validación funcional de los productos desarrolladosPerfil del candidato Ingeniería Electrónica - Telecomunicaciones  Inglés nivel B2-C1  Experiencia en control de motores (brushless de imanes permanentes, inducción, universal)  Experiencia en control de displays TFTOferta de empleo Oportunidades de carrera y desarrollo profesional.  Horario intensivo viernes  Flexibilidad horaria entrada/salida  Plan de carrera profesional",Barcelona,,"['Programador', 'Categoría o nivelTécnico']",Jornada Completa,Al menos 3 años de experiencia,Contrato Indefinido,Retribución sin especificar,0.0,2024-01-26,https://www.infoempleo.com/ofertasdetrabajo/ingenieroa-firmware-empresa-electronica-en-el-valles/barcelona/3009660/,infoempleo
TÉCNICO/A DE INFORMÁTICA Barcelona,"IMAN TEMPORING ETT, S.L.",Hace 8 horas (Actualizada),"Somos una empresa comprometida con la igualdad y no discriminamos por género, etnia, orientación sexual, diversidad funcional, edad u otros aspectos protegidos por la legislación. Éste proceso de selección se basa en criterios objetivos de  profesionalidad, méritos y capacidad.REQUISITOS- Nivel medio-alto de inglés para poder comunicarse con la central en Francia.- Poder desplazarse 1 día a la semana a la oficina de La Granada del Penedés.HABILIDADES REQUERIDAS:-Conocimientos de la arquitectura hardware de una estación de trabajo-Cambiar/reparar un artículo o equipo defectuoso.-Saber seguir y reproducir los procedimientos de instalación-Guiar al usuario para resolver un mal funcionamiento de software o hardware.-Buen conocimiento del sistema operativo Windows 10, así como del software común (ofimática, Office 365, Adobe, Internet, etc.)-Conocimiento de los procesos de despliegue a través de SCCM-Capacidad para trabajar en equipo e interactuar con los usuarios-Habilidades interpersonales, diplomacia, sentido de servicio, rigor-Redacción de procedimientos","Desde IMAN Temporing, empresa especializada en RRHH, queremos acompañarte en tu trayectoria laboral. #ConectamoseltalentoconlasoportunidadesDesde la oficina del Prat de Llobregat de IMAN Temporing, estamos buscando para una empresa ubicada en el Prat:Un/a TECNICO/A DE INFORMÁTICADependiendo del departamento de RRHH, Soporte Organización y QSE, El técnico de informática solucionará problemas, mantendrá e instalará diversos equipos informáticos (hardware, software, impresoras redes, etc.), en conformidad con las normas de seguridad y las normas pertinentes en colaboración directa con la sede principal en Francia.FUNCIONES PRINCIPALES:- Recepción de llamadas, emails, mensajes instantáneos de incidentes usuarios, categorización, gestión de prioridades-Diagnóstico y tratamiento de incidencias ya sea por control remoto o por intervención in situ-Gestión, instalación y mantenimiento de equipos informáticos (puestos de trabajo informáticos, periféricos)-Instalar/configurar la estación de trabajo según las necesidades del usuario y realizar pruebas funcionales-Traslado de equipos informáticos-Gestionar el acceso de los usuarios al SI (llegadas/salidas, acceso a los recursos) de acuerdo con estrictas normas de seguridad-Usuario avanzado en los sistemas, estará relación con los técnicos de Service Desk (N1), Analistas de Explotación (N2) e ingenieros sistemas/redes (N3)-Posibilidad de evolución hacia Referente IT y analista/programador para soportar la organización en todo el ámbito técnico.",Barcelona,,"['Técnico de Soporte', 'Categoría o nivelTécnico']",,No se requiere experiencia,,Entre 20.000 y 25.000€ Brutos/anuales,8.0,2024-01-26,https://www.infoempleo.com/ofertasdetrabajo/tecnicoa-de-informatica/barcelona/3009316/,infoempleo
Docente IFCT0108 Operaciones Aux. Mont y Mant Sistemas Microinformáticos. Presen Cuéllar (Segovia),Empresa dedicada a la Formación Profesional para el empleo.,Hace 6 horas (Actualizada),"Se busca docente para impartir el Certificado de Profesionalidad de IFCT0108 ""OPERACIONES AUXILIARES DE MONTAJE Y MANTENIMIENTO DE SISTEMAS MICROINFORMÁTICOS""  (370 horas).https://apps.lanbide.euskadi.net/descargas/egailancas/certificados/normativa/IFCT0108_NOR.pdf MF1207_1: Operaciones auxiliares de montaje de componentes informáticos (130 h)•UF0465: Montaje de componentes y periféricos microinformáticos (90 h)•UF0466: Testeo y verificación de equipos y periféricos microinformáticos (40 h)MF1208_1: Operaciones auxiliares de mantenimiento de sistemas microinformáticos (70 h)MF1209_1: Operaciones auxiliares con tecnologías de la información y la comunicación (90h).MP0098: Módulo de prácticas profesionales no laborales de Operaciones Auxiliares de Montaje y Mantenimiento de Sistemas Microinformáticos (80 horas).Titulación Académica (al menos poseer uno):- Cualquier titulación universitaria.- Técnico Superior de la familia profesional de Informática y Comunicaciones .- Certificado de profesionalidad de nivel 3 de la Familia Profesional de Informática y Comunicaciones y del Área de    Sistemas y Telemática.Titulación Docente:- Certificado de Profesionalidad de Docencia de la Formación Profesional para el Empleo- Certificado de Aptitud Pedagógica (CAP), Máster Universitario en Formación del Profesorado de Educación Secundaria Obligatoria y Bachillerato o 600 h de impartición en Formación Profesional para el Empleo.Experiencia Profesional:- Mínimo 1 año de experiencia profesional en la materia a impartir con titulación y 3 años sin titulación.","Se busca docente para impartir el Certificado de Profesionalidad de IFCT0108 ""Operaciones Auxiliares de Montaje y Mantenimiento de Sistemas Microinformáticos""Modalidad: Presencial:Lugar: Cuéllar, (Segovia).Duración: 370 horas.Fechas: 21/02/2024-11/06/2024Horario: 09:00-14:00h",Cuéllar (Segovia),,"['Docente Área Informática', 'Formador Técnico', 'Categoría o nivelTécnico']",Jornada Parcial,Al menos 1 año de experiencia,Contrato De duración determinada,Retribución sin especificar,2.0,2024-01-26,https://www.infoempleo.com/ofertasdetrabajo/docente-ifct0108-operaciones-aux-mont-y-mant-sistemas-microinformaticos-presen/cuellar/3008986/,infoempleo
Ingeniero Informático (contrato indefinido) Madrid (Madrid),"GABINETE PROFESIONAL DE INGENIEROS INFORMÁTICOS, S.L.U.",Hace 17 horas (Actualizada),"Se trata de un perfil técnico, ingeniero informático, graduado en informática (superior) o equivalente.Deberás tener conocimientos en herramientas de administración tanto de Windows como Linux. Algo de experiencias con bases de datos tipo SQL sería de valorar.¡Y si has trabajado en el sector Healthcare ¡sería ideal!Pero tranquil@ que no es imprescindible… el inglés, sin embargo, sí que lo es.Algo muy importante para nosotros son las ""temidas"" softskills, buscamos una persona, ante todo, proactiva y resolutiva, que sepa trabajar en equipo y con habilidades comunicativas.","¡Estamos buscando un candidato para sumarse a nuestro equipo! Un grupo variado, talentoso y sobre todo unido.",Madrid,,"['Técnico de Sistemas', 'Categoría o nivelTécnico']",,Entre 1 y 3 años de experiencia,,Entre 29.000 y 40.000€ Brutos/anuales,19.0,2024-01-26,https://www.infoempleo.com/ofertasdetrabajo/ingeniero-informatico-contrato-indefinido/madrid/3008814/,infoempleo
System Security Engineer Estados Unidos,THE WISE SEEKER S.L,Hace 32 horas (Actualizada),"-Due to the sensitivity of customer related requirements, U.S. Citizenship is required.-Candidate must have a master's degree in a specialized field plus a minimum of 4 years of applicable experience; or, a bachelor's degree in the specialized field plus 5 years of applicable experience; or, a bachelor's degree in any field with a minimum of 7 years of specialized experience.-Must have a Top Secret clearance.-Candidate will provide subject matter expertise in the system engineering technical review (SETR) process and through each adaptive acquisition framework pathway.-Must have thorough understanding of engineering principles and analyze a wide range of technology principles.-Must have familiarity with security requirements (e.g., anti-tamper, exportability features, supply chain risk management, secure design, defense-in-depth and cybersecurity implementation) required.-Must have DAU Courses such as ACQ 160 or ENG 260 or equivalent experience.-Must have a DoD Top Secret Clearance","At The Wise Seeker, we're seeking a System Security Engineer subject matter expert (e.g. anti-tamper, exportability features, and secure design) to represent program protection equities in the system engineering technical review (SETR) process to ensure adequate protection measures are incorporated across the entire customer portfolio and throughout each’s product’s lifecycle.The System Security Engineer (SSE) will provide Technology Protection and engineering assistance to an Army acquisition program. Apply scientific and engineering principles to identify security vulnerabilities in hardware, software, or firmware and develop risks and mitigations associated with these vulnerabilities. Position will play a key role in protecting critical technology and recommending appropriate countermeasures and program protection strategies.Tasks-Document program protection planning in the systems engineering plan (SEP), program protection plan (PPP) and system security plan (SSP).-Analyze and assist engineering and program management with program protection requirements analysis.-Provide technical support to identify vulnerabilities for CPI, mission critical functions, mission critical components, and recommend appropriate security controls.-Support system threat assessments, vulnerability identification, security risk analysis, and security test and evaluation.-Provide System Security Engineer subject matter expertise in meetings, system engineering technical review (SETR) process, and through each adaptive acquisition framework pathway.",Estados Unidos - Maryland,Teletrabajo parcial,"['Técnico de Seguridad', 'Técnico de Sistemas', 'Categoría o nivelTécnico']",Jornada Completa,Al menos 4 años de experiencia,Contrato Indefinido,Retribución sin especificar,0.0,2024-01-26,https://www.infoempleo.com/ofertasdetrabajo/system-security-engineer/maryland/3014259/,infoempleo
Senior .NET Developer Otros Paises,THE WISE SEEKER S.L,Hace 32 horas (Actualizada),"-­ Have 6+ years of experiences-Bachelor‘s degree in computer science or equivalent-Proficiency in C# and .NET Core framework-Good communication in English-Be hardworking, passionate and possess a can­do attitude.-Be good at critical, logical thinking and problem­solving skill-Be assertive, honest and trustworthy-Happy to deal with the opposite and different ideas-Be a good team player and patient person-Be a self­learner","At The Wise Seeker, we are looking for a Senior .NET Developer to work with one of our clients located in Vietnam: a company that helps brands and retailers effortlessly retouch product images for e­commerce to boost their online sales and reduce returns.Working Location: HanoiSector: IT  Tasks-We are looking for a great .NET developer who is proficient with C#. -Your primary focus will be on developing back­end components, data layers and API. You will ensure that these -components and the overall application are robust, scalable and easy to maintain. -You will coordinate with the rest of the team working on different layers of the infrastructure -Therefore, a commitment to collaborative problem solving, sophisticated design, and quality product is important.-Architect and build robust, scalable, highly available and reliable systems-Building reusable components and front­end libraries for future use-Proactively research for solutions to problems-Work closely with the client teams and product design team to iterate quickly on new features and experiments-Participate in design discussions, code reviews and group brainstorming sessions-Deliver high quality code following best practices for better performance, user experience, and reusability-Troubleshoot existing code bases, hunt down nasty bugs and refactor code",Otros Paises - Hanoi,,"['Programador .NET', 'Ingeniero de Software C#', 'Categoría o nivelTécnico']",Jornada Completa,Al menos 6 años de experiencia,Contrato Indefinido,Retribución sin especificar,1.0,2024-01-26,https://www.infoempleo.com/ofertasdetrabajo/senior-net-developer/hanoi/3014229/,infoempleo
Beca soporte informático. Santa Cruz de Tenerife,TECH España,Hace 30 horas (Actualizada),"-  Estar cursando en la actualidad una formación en Ciclo Medio, Superior o Grado Universitario en Informática, electrónica o formaciones afines.- Disponibilidad de realizar un convenio en prácticas con su centro de estudios (Requisito imprescindible).","1.	Reparación de equipos portátiles.2.	Formación como Soporte IT (Se les formaría en entornos de trabajo basados en Tickets-JIRA).3.	Resolución de incidencias (Windows, Android, PowerShell, Mac, Azure...).4.	Resoluciones presenciales y remotas con usuarios.5.	Formación en conocimientos básicos de Datos (SQL).",Santa Cruz de Tenerife,,['Categoría o nivel'],Jornada Completa,No se requiere experiencia,Contrato Prácticas,Entre 5.000 y 6.000€ Brutos/anuales,1.0,2024-01-26,https://www.infoempleo.com/ofertasdetrabajo/beca-soporte-informatico/santa-cruz-de-tenerife/3014563/,infoempleo
TECNICO/A INFORMATICO Madrid (Madrid),"IMAN TEMPORING ETT, S.L.",Hace 39 horas (Actualizada),"Somos una empresa comprometida con la igualdad y no discriminamos por género, etnia, orientación sexual, diversidad funcional, edad u otros aspectos protegidos por la legislación. Éste proceso de selección se basa en criterios objetivos de  profesionalidad, méritos y capacidad.FP Grado Superior \ Titulación técnica en Informática Experiencia en microinformática y sistemas y formación en administración en sistemas informáticos o similar.Experiencia mínima de un año.Conocimiento y experiencia en Windows 10, Windows 2016 - 2019 serverConocimientos altos en Office 365.Conocimientos de nivel medio de redes Ethernet/IP y sistemas de telecomunicación.Conocimientos de nivel medio protocolos de red y servicios asociados (ipv4, DNS, DHCP).Conocimientos medios en SQL serverConocimientos Fortinet (Firewall)","Desde IMAN Temporing, empresa especializada en RRHH, queremos acompañarte en tu trayectoria laboral. #ConectamoseltalentoconlasoportunidadesDesde nuestra oficina de Ciudad Real  , seleccionamos un/a Técnico Informático para importante empresa del sector Vitivinícola  , ubicada en la zona de Socuéllamos. Las funciones a desarrollar son las siguientes: - Gestionar las incidencias informática y peticiones usuarios - Monitorización del parque informático.- Realización de tareas de BackOffice de las cuentas (configuración de periféricos, revisión parque, traslados, informes de estados, etc.- Instalación y configuración software microinformática y de aplicaciones. (Microsoft office, antivirus, ERP, SGA, etc.).- Detección y seguimiento de averías de Hardware.- Instalación sistema (Pc,s, Terminales, teléfonos y tablets).- Operaciones básicas de sistema.- Cloud (Office 365, Azure, Exchange, Active directory, SharePoint, Teams, Skype)- Virtualización (VMware)- Mantenimiento de Impresoras Industriales - Valorable experiencia con Servidores Windows y/o productos Microsoft - Habilidades de comunicación- Trabajo en equipo.- Capacidad de trabajar bajo presión.",Madrid,,"['Técnico de Hardware y Software', 'Categoría o nivelTécnico']",,Al menos 2 años de experiencia,,Entre 20.000 y 25.000€ Brutos/anuales,24.0,2024-01-26,https://www.infoempleo.com/ofertasdetrabajo/tecnicoa-informatico/madrid/3008267/,infoempleo
TÉCNIC/A INFORMÁTIC/A Lleida (Lleida),"IMAN TEMPORING ETT, S.L.",Hace 5 horas (Actualizada),"Somos una empresa comprometida con la igualdad y no discriminamos por género, etnia, orientación sexual, diversidad funcional, edad u otros aspectos protegidos por la legislación. Éste proceso de selección se basa en criterios objetivos de  profesionalidad, méritos y capacidad.Requisitos: -Técnico en microinformática y redes. (Grado medio)","Desde IMAN Temporing, empresa especializada en RRHH, queremos acompañarte en tu trayectoria laboral. #ConectamoseltalentoconlasoportunidadesDesde la delegación de Tárrega estamos buscando un técnico/a informático/a para una importante empresa de la zona.",Lleida,,"['Técnico de Soporte', 'Categoría o nivelTécnico']",,No se requiere experiencia,,Entre 15.000 y 20.000€ Brutos/anuales,9.0,2024-01-26,https://www.infoempleo.com/ofertasdetrabajo/tecnica-informatica/lleida/3007876/,infoempleo
